{
  "protocol": "http://email-protocol.xyz",
  "published": true,
  "types": {
    "email": {
      "schema": "email",
      "dataFormats": [
        "text/plain"
      ]
    }
  },
  "structure": {
    "email": {
      "$actions": [
        {
          "who": "anyone",
          "can": [
            "create"
          ]
        },
        {
          "who": "author",
          "of": "email",
          "can": [
            "read",
            "query",
            "subscribe"
          ]
        },
        {
          "who": "recipient",
          "of": "email",
          "can": [
            "read",
            "query",
            "subscribe"
          ]
        }
      ],
      "email": {
        "$actions": [
          {
            "who": "anyone",
            "can": [
              "create"
            ]
          },
          {
            "who": "author",
            "of": "email/email",
            "can": [
              "read",
              "query",
              "subscribe"
            ]
          },
          {
            "who": "recipient",
            "of": "email/email",
            "can": [
              "read",
              "query",
              "subscribe"
            ]
          }
        ]
      }
    }
  }
}
