{
  "protocol": "http://social-media.xyz",
  "published": true,
  "types": {
    "message": {
      "schema": "messageSchema",
      "dataFormats": [
        "text/plain"
      ]
    },
    "reply": {
      "schema": "replySchema",
      "dataFormats": [
        "text/plain"
      ]
    },
    "image": {
      "schema": "imageSchema",
      "dataFormats": [
        "image/jpeg",
        "image/gif",
        "image/png"
      ]
    },
    "caption": {
      "schema": "captionSchema",
      "dataFormats": [
        "text/plain"
      ]
    }
  },
  "structure": {
    "message": {
      "$actions": [
        {
          "who": "anyone",
          "can": [
            "create",
            "update"
          ]
        }
      ],
      "reply": {
        "$actions": [
          {
            "who": "recipient",
            "of": "message",
            "can": [
              "create",
              "update"
            ]
          }
        ]
      }
    },
    "image": {
      "$actions": [
        {
          "who": "anyone",
          "can": [
            "read",
            "create",
            "update"
          ]
        }
      ],
      "caption": {
        "$actions": [
          {
            "who": "anyone",
            "can": [
              "read"
            ]
          },
          {
            "who": "author",
            "of": "image",
            "can": [
              "create",
              "update"
            ]
          }
        ]
      },
      "reply": {
        "$actions": [
          {
            "who": "author",
            "of": "image",
            "can": [
              "read",
              "query",
              "subscribe"
            ]
          },
          {
            "who": "recipient",
            "of": "image",
            "can": [
              "create",
              "update"
            ]
          }
        ]
      }
    }
  }
}