{
  "protocol": "http://thread-role.xyz",
  "published": true,
  "types": {
    "thread": {},
    "participant": {},
    "admin": {},
    "globalAdmin": {},
    "chat": {}
  },
  "structure": {
    "globalAdmin": {
      "$role": true
    },
    "thread": {
      "$actions": [
        {
          "role": "thread/participant",
          "can": [
            "read"
          ]
        }
      ],
      "admin": {
        "$role": true
      },
      "participant": {
        "$role": true,
        "$actions": [
          {
            "role": "thread/participant",
            "can": [
              "read",
              "create"
            ]
          }
        ]
      },
      "chat": {
        "$actions": [
          {
            "role": "thread/participant",
            "can": [
              "create",
              "update",
              "read"
            ]
          },
          {
            "role": "thread/admin",
            "can": [
              "co-update",
              "co-delete"
            ]
          },
          {
            "role": "globalAdmin",
            "can": [
              "co-delete"
            ]
          }
        ]
      }
    }
  }
}